<!DOCTYPE pointList
        [
                <!ELEMENT pointList (point*)>
                <!ELEMENT point (x,y,unit)>
                <!ELEMENT x (#PCDATA)>
                <!ELEMENT y (#PCDATA)>
                <!ELEMENT unit (#PCDATA)>
                ]>