<?xml version="1.0" encoding="UTF-8"?>
<!DOCTYPE pointList SYSTEM "example.dtd">
<pointList>
    <point>
        <x>2</x>
        <y>5</y>
    </point>

    <point>
        <x>2</x>
        <y>5</y>
        <unit>mm</unit>
    </point>

</pointList>
